suggestion_category,recommendation,implementation,effectiveness_rating,resource_requirements
early_intervention,Regular_check_ins_with_at_risk_individuals,Weekly phone calls or visits,high,moderate_staffing
early_intervention,Monitor_social_media_for_warning_signs,Digital monitoring tools with consent,medium,technology_investment
early_intervention,Establish_safety_plans_with_clients,Written plans with emergency contacts,high,minimal_cost
de_escalation_training,Provide_crisis_de_escalation_training,Quarterly training sessions for staff,high,training_budget
de_escalation_training,Teach_verbal_de_escalation_techniques,Role_playing scenarios,high,moderate_time
de_escalation_training,Develop_calm_environment_protocols,Quiet spaces and sensory tools,medium,physical_space
risk_assessment,Implement_standardized_risk_assessment_tools,Use validated screening instruments,high,assessment_tools
risk_assessment,Regular_risk_reassessment,Monthly or as needed based on changes,high,staff_time
risk_assessment,Document_risk_factors_and_changes,Electronic health record documentation,high,record_system
communication_protocols,Establish_clear_communication_channels,Direct lines to crisis responders,high,communication_system
communication_protocols,Develop_escalation_procedures,Clear chain of command for crises,high,protocol_development
communication_protocols,Create_emergency_contact_lists,Updated contact information for all stakeholders,high,maintenance_time
technology_integration,Use_crisis_monitoring_software,Real_time alerts and tracking,high,software_licensing
technology_integration,Implement_mobile_crisis_apps,24_7 access to crisis resources,medium,app_development
technology_integration,Utilize_telehealth_for_crisis_intervention,Remote crisis assessment and support,high,telehealth_platform
community_partnerships,Partner_with_local_crisis_services,Memoranda of understanding with providers,high,partnership_development
community_partnerships,Establish_relationships_with_law_enforcement,Protocols for crisis situations,high,relationship_building
community_partnerships,Connect_with_mental_health_providers,Referral networks and care coordination,high,network_development
cultural_competency,Provide_culturally_sensitive_crisis_intervention,Training on cultural differences,high,cultural_training
cultural_competency,Offer_multilingual_crisis_support,Translation services and materials,high,translation_services
cultural_competency,Respect_religious_and_spiritual_beliefs,Incorporate spiritual support when appropriate,medium,cultural_awareness
data_analytics,Track_crisis_incidents_and_outcomes,Data collection and analysis systems,high,analytics_platform
data_analytics,Monitor_trends_in_crisis_frequency,Regular reporting and trend analysis,medium,data_analysis_time
data_analytics,Evaluate_intervention_effectiveness,Outcome measurement and quality improvement,high,evaluation_framework
staff_support,Provide_regular_supervision_for_crisis_workers,Weekly supervision sessions,high,supervision_time
staff_support,Offer_debriefing_after_crisis_incidents,Immediate and follow_up debriefing,high,debriefing_protocols
staff_support,Ensure_access_to_mental_health_support,Employee assistance programs,high,eap_services
prevention_strategies,Implement_mental_health_education_programs,Regular educational sessions,medium,education_materials
prevention_strategies,Promote_healthy_coping_mechanisms,Skills_based training programs,medium,program_development
prevention_strategies,Create_supportive_environmental_factors,Physical and social environment modifications,medium,environmental_changes
