tool_type,description,purpose,features,pros,cons
Portfolio Trackers,Monitor investment performance,Performance tracking, rebalancing,Real-time data, analytics, reporting,Comprehensive view, automated tracking,Data accuracy, privacy concerns
Stock Screeners,Filter stocks by criteria,Stock research, discovery,Custom filters, fundamental data, technical indicators,Save time, systematic approach,Data quality, user expertise
Charting Software,Technical analysis tools,Price analysis, pattern recognition,Multiple timeframes, indicators, drawing tools,Visual analysis, pattern recognition,Learning curve, interpretation
Financial Calculators,Investment calculations,Planning, analysis,Compound interest, retirement, loan calculators,Accurate calculations, planning tools,Limited scope, basic features
News Aggregators,Financial news collection,Market information, analysis,Real-time news, alerts, sentiment analysis,Stay informed, timely updates,Information overload, bias
Research Platforms,Comprehensive investment research,Company analysis, market research,Financial statements, analyst reports, ratings,In-depth analysis, professional data,Cost, complexity
Trading Platforms,Execute trades,Order management, execution,Real-time quotes, order types, mobile access,Convenience, speed, execution quality,Fees, platform reliability
Tax Software,Investment tax preparation,Tax reporting, optimization,Trade tracking, tax loss harvesting, optimization,Accurate reporting, tax savings,Complexity, cost
Risk Analysis Tools,Portfolio risk assessment,Risk management, optimization,Stress testing, scenario analysis, correlation,Risk awareness, optimization,Complexity, assumptions
Backtesting Software,Strategy testing,Strategy validation, optimization,Historical data, performance metrics, optimization,Strategy validation, optimization,Historical bias, overfitting
Dividend Trackers,Dividend monitoring,Dividend income tracking,Dividend history, yield tracking, payment schedules,Income tracking, planning,Data accuracy, limited scope
Options Analysis,Options strategy analysis,Options trading, risk management,Profit/loss analysis, Greeks, strategy builder,Complex analysis, risk management,Complexity, learning curve
Cryptocurrency Wallets,Digital asset storage,Security, transaction management,Multi-currency support, security features, transaction history,Security, control,Technical complexity, security risks
Real Estate Analysis,Property investment analysis,Real estate evaluation, investment analysis,Cap rate, cash flow, ROI calculations,Investment analysis, decision support,Limited data, local focus
Retirement Calculators,Retirement planning,Retirement planning, goal setting,Goal tracking, scenario analysis, recommendations,Planning tools, goal setting,Assumptions, limited scope
